Light Clay,Hold items,A Pok\xc3\xa9mon held item that extends the duration of barrier moves like Light Screen and Reflect used by the holder.
Lone Earring,General items,
Lonely Mint,Battle items,Changes the Pok\xc3\xa9mon\'s stats to match the Lonely nature.
Looker Ticket,Hold items,A ticket that was handmade by Looker. It\'s decorated with a liberal amount of glittery paint.
Lopunnite,Hold items,Enables Lopunny to Mega Evolve during battle.
Love Ball,Pokeballs,Pok\xc3\xa9 Ball for catching Pok\xc3\xa9mon that are the opposite gender of your Pok\xc3\xa9mon.
Love Sweet,Hold items,Evolves Milcery into Heart Flavor Alcremie.
Lucarionite,Hold items,Enables Lucario to Mega Evolve during battle.
Luck Incense,Hold items,Doubles prize money if held. Breeding Chansey or Blissey produces Happiny when held.
Lucky Egg,Hold items,An item to be held by a Pok\xc3\xa9mon. It is an egg filled with happiness that earns extra Exp. Points in battle.
Lucky Punch,Hold items,Increases critical-hit ratio when held by Chansey.
Lum Berry,Berries,"If held by a Pok\xc3\xa9mon, it recovers from any status problem."
Luminous Moss,Hold items,Raises Special Defense if hit by a Water-type move.
Lumiose Galette,Medicine,Heals all major status conditions.
Lunalium Z,Hold items,"Allows Lunala to upgrade Moongeist Beam to a Z-Move, Menacing Moonraze Maelstrom."
Lure,General items,Attracts Pok\xc3\xa9mon in the wild.
Lure Ball,Pokeballs,A Pok\xc3\xa9 Ball for catching Pok\xc3\xa9mon hooked by a Rod when fishing.
Lustrous Orb,Hold items,Increases the power of Dragon- and Water-type moves when held by Palkia.
Luxury Ball,Pokeballs,A comfortable Pok\xc3\xa9 Ball that makes a caught wild Pok\xc3\xa9mon quickly grow friendly.
Lycanium Z,Hold items,"Allows Lycanroc to upgrade Stone Edge to a Z-Move, Splintered Stormshards."
Macho Brace,Hold items,An item to be held by a Pok\xc3\xa9mon. It is a stiff and heavy brace that promotes strong growth but lowers Speed.
Magmarizer,General items,Evolves Magmar when traded holding the item.
Magnet,Hold items,Increases the power of Electric-type moves.
Mago Berry,Berries,"Restores HP if it\'s low, but may cause confusion."
Magost Berry,Berries,A Berry which is very rare in the Unova region. A maniac will buy it for a high price.
Manectite,Hold items,Enables Manectric to Mega Evolve during battle.
Maranga Berry,Berries,"If held by a Pok\xc3\xa9mon, this Berry will increase the holder\'s Sp. Def if it\'s hit with a special move."
Marble,General items,
Marshadium Z,Hold items,"Allows Marshadow to upgrade Spectral Thief to a Z-Move, Soul-Stealing 7-Star Strike."
Master Ball,Pokeballs,The best Ball with the ultimate level of performance. It will catch any wild Pok\xc3\xa9mon without fail.
Mawilite,Hold items,Enables Mawile to Mega Evolve during battle.
Max Elixir,Medicine,It fully restores the PP of all the moves learned by the targeted Pok\xc3\xa9mon.
Max Ether,Medicine,It fully restores the PP of a single selected move that has been learned by the target Pok\xc3\xa9mon.
Max Lure,General items,Attracts Pok\xc3\xa9mon in the wild.
Max Potion,Medicine,Fully restores HP.
Max Repel,General items,An item that prevents weak wild Pok\xc3\xa9mon from appearing for 250 steps after its use.
Max Revive,Medicine,A medicine that revives a fainted Pok\xc3\xa9mon. It fully restores the Pok\xc3\xa9mon\'s HP.
Meadow Plate,Hold items,Increases power of Grass-type moves. Changes Arceus\' type to Grass.
Medichamite,Hold items,Enables Medicham to Mega Evolve during battle.
Mental Herb,Hold items,An item to be held by a Pok\xc3\xa9mon. It snaps the holder out of infatuation. It can be used only once.
Metagrossite,Hold items,Enables Metagross to Mega Evolve during battle.
Metal Coat,Hold items,Increases the power of Steel-type moves. Evolves Onix and Scyther when traded holding the item.
Metal Powder,Hold items,Increases Defense when held by Ditto.
Metronome,Hold items,Increases the power of moves used consecutively.
Mewnium Z,Hold items,"Allows Mew to upgrade Psychic to a Z-Move, Genesis Supernova."
Mewtwonite X,Hold items,Enables Mewtwo to Mega Evolve during battle.
Mewtwonite Y,Hold items,Enables Mewtwo to Mega Evolve during battle.
Micle Berry,Berries,Increases a move\'s accuracy when HP is low.
Mighty Candy,Medicine,Increases a Pok\xc3\xa9mon\'s Attack stat by 1.
Mighty Candy L,Medicine,Increases a Pok\xc3\xa9mon\'s Attack stat.
Mighty Candy XL,Medicine,Increases a Pok\xc3\xa9mon\'s Attack stat.
Mild Mint,Battle items,Changes the Pok\xc3\xa9mon\'s stats to match the Mild nature.
Mimikium Z,Hold items,"Allows Mimikyu to upgrade Play Rough to a Z-Move, Let\'s Snuggle Forever."
Mind Plate,Hold items,Increases power of Psychic-type moves. Changes Arceus\' type to Psychic.
Miracle Seed,Hold items,Increases the power of Grass-type moves.
Misty Seed,Hold items,An item to be held by a Pok\xc3\xa9mon. It boosts Sp. Def on Misty Terrain. It can only be used once.
Modest Mint,Battle items,Changes the Pok\xc3\xa9mon\'s stats to match the Modest nature.
Moomoo Milk,Medicine,Milk with a very high nutrition content. It restores the HP of one Pok\xc3\xa9mon by 100 points.
Moon Ball,Pokeballs,A Pok\xc3\xa9 Ball for catching Pok\xc3\xa9mon that evolve using the Moon Stone.
Moon Stone,General items,Evolves certain species of Pok\xc3\xa9mon.
Muscle Band,Hold items,Increases the power of Physical-category moves.
Muscle Wing,Medicine,Increases Attack EVs by 1.
Mystic Water,Hold items,Increases the power of Water-type moves.
Naive Mint,Battle items,Changes the Pok\xc3\xa9mon\'s stats to match the Naive nature.
Nanab Berry,Berries,"A Berry to be used in cooking. Calms a Pok\xc3\xa9mon in battle, in Let\'s Go Pikachu/Eevee."
Naughty Mint,Battle items,Changes the Pok\xc3\xa9mon\'s stats to match the Naughty nature.
Nest Ball,Pokeballs,A somewhat different Pok\xc3\xa9 Ball that works especially well on weaker Pok\xc3\xa9mon in the wild.
Net Ball,Pokeballs,A somewhat different Pok\xc3\xa9 Ball that works especially well on Water- and Bug-type Pok\xc3\xa9mon.
Never-Melt Ice,Hold items,Increases the power of Ice-type moves.
Nomel Berry,Berries,A Berry which is very rare in the Unova region. A maniac will buy it for a high price.
Normal Gem,Hold items,Increases the power of a Normal-type move only once.
Normalium Z,Hold items,"Allows the use of Breakneck Blitz, the Normal type Z-Move."
Nugget,General items,A nugget of pure gold that gives off a lustrous gleam. It can be sold at a high price to shops.
Occa Berry,Berries,Weakens a supereffective Fire-type attack against the holding Pok\xc3\xa9mon.
Odd Incense,Hold items,Increases the power of Psychic-type moves. Breeding Mr. Mime produces Mime Jr. when held.
Odd Keystone,General items,A vital item that is needed to keep a stone tower from collapsing. Voices can be heard from it occasionally.
Old Amber,General items,A piece of amber that contains the genetic material of an ancient Pok\xc3\xa9mon. It is clear with a reddish tint.
Old Gateau,Medicine,Heals all major status conditions.
Oran Berry,Berries,"If held by a Pok\xc3\xa9mon, it heals the user by just 10 HP."
Oval Charm,General items,An oval charm said to increase the chance of Pok\xc3\xa9mon Eggs being found at the Day Care.
Oval Stone,General items,Evolves Happiny when held.
Pack of Potatoes,General items,
Pamtre Berry,Berries,A Berry which is very rare in the Unova region. A maniac will buy it for a high price.
Paralyze Heal,Medicine,A spray-type medicine. It eliminates paralysis from a single Pok\xc3\xa9mon.
Park Ball,Pokeballs,A special Pok\xc3\xa9 Ball for the Pal Park.
Pass Orb,Hold items,"A mysterious orb containing the power of the Unova region, to be used when generating Pass Power."
Passho Berry,Berries,Weakens a supereffective Water-type attack against the holding Pok\xc3\xa9mon.
Payapa Berry,Berries,Weakens a supereffective Psychic-type attack against the holding Pok\xc3\xa9mon.
Pearl,General items,A somewhat-small pearl that sparkles in a pretty silver color. It can be sold cheaply to shops.
Pearl String,General items,Very large pearls that sparkle in a pretty silver color. A maniac will buy them for a high price.
Pecha Berry,Berries,"If held by a Pok\xc3\xa9mon, it recovers from poison."
Permit,General items,A permit that is needed to enter the Nature Preserve. Not many know about it.
Persim Berry,Berries,"If held by a Pok\xc3\xa9mon, it recovers from confusion."
Petaya Berry,Berries,Raises Special Attack when HP is low.
Pewter Crunchies,Medicine,Heals all major status conditions.
Pidgeotite,Hold items,Enables Pidgeot to Mega Evolve during battle.
Pikanium Z,Hold items,"Allows Pikachu to upgrade Volt Tackle to a Z-Move, Catastropika."
Pikashunium Z,Hold items,"Allows Pikachu in a cap to upgrade Thunderbolt to a Z-Move, 10,000,000 Volt Thunderbolt."
Pinap Berry,Berries,"A Berry to be used in cooking. Increases chances of getting items when a Pok\xc3\xa9mon is caught, in Pok\xc3\xa9mon Let\'s Go."
Pink Apricorn,General items,"A pink Apricorn. It has a nice, sweet scent."
Pink Nectar,Hold items,The flower nectar obtained at the flowering shrubs on Royal Avenue. It changes the form of certain species of Pok\xc3\xa9mon.
Pink Scarf,General items,Raises holder\'s Cute aspect in a Contest.
Pinsirite,Hold items,Enables Pinsir to Mega Evolve during battle.
Pixie Plate,Hold items,Increases power of Fairy-type moves. Changes Arceus\' type to Fairy.
Plasma Card,Hold items,A card key needed to enter the password inside the Plasma Frigate.
Plume Fossil,General items,A fossil of an ancient Pok\xc3\xa9mon that flew in the sky in ancient times. It appears to be part of its wing.
Poison Barb,Hold items,Increases the power of Poison-type moves.
Poison Gem,Hold items,Increases the power of a Poison-type move only once.
Poison Memory,Hold items,Changes Silvally and its move Multi-Attack to Poison type.
Poisonium Z,Hold items,"Allows the use of Acid Downpour, the Poison type Z-Move."
Pok\xc3\xa9 Ball,Pokeballs,A device for catching wild Pok\xc3\xa9mon. It is thrown like a ball at the target. It is designed as a capsule system.
Pok\xc3\xa9 Doll,General items,A doll that attracts Pok\xc3\xa9mon. Use it to flee from any battle with a wild Pok\xc3\xa9mon.
Pok\xc3\xa9 Toy,General items,An item that attracts Pok\xc3\xa9mon. Use it to flee from any battle with a wild Pok\xc3\xa9mon.
Polished Mud Ball,General items,
Pomeg Berry,Berries,Increases Friendship but lowers HP EVs.
Potion,Medicine,Restores 20 HP.
Power Anklet,Hold items,"A Pok\xc3\xa9mon held item that promotes Speed gain on leveling, but reduces the Speed stat."
Power Band,Hold items,"A Pok\xc3\xa9mon held item that promotes Sp. Def gain on leveling, but reduces the Speed stat."
Power Belt,Hold items,"A Pok\xc3\xa9mon held item that promotes Defense gain on leveling, but reduces the Speed stat."
Power Bracer,Hold items,"A Pok\xc3\xa9mon held item that promotes Attack gain on leveling, but reduces the Speed stat."
Power Herb,Hold items,A single-use item to be held by a Pok\xc3\xa9mon. It allows the immediate use of a move that charges on the first turn.
Power Lens,Hold items,"A Pok\xc3\xa9mon held item that promotes Sp. Atk gain on leveling, but reduces the Speed stat."
Power Plant Pass,Hold items,This pass serves as an ID card for gaining access to the power plant that lies along Route 13.
Power Weight,Hold items,"A Pok\xc3\xa9mon held item that promotes HP gain on leveling, but reduces the Speed stat."
PP Max,Medicine,It maximally raises the top PP of a selected move that has been learned by the target Pok\xc3\xa9mon.
PP Up,Medicine,It slightly raises the maximum PP of a selected move that has been learned by the target Pok\xc3\xa9mon.
Premier Ball,Pokeballs,A somewhat rare Pok\xc3\xa9 Ball that has been specially made to commemorate an event of some sort.
Pretty Wing,General items,"Though this feather is beautiful, it\'s just a regular feather and has no effect on Pok\xc3\xa9mon."
Primarium Z,Hold items,"Allows Primarina to upgrade Sparkling Aria to a Z-Move, Oceanic Operetta."
Prism Scale,General items,Evolves Feebas when traded holding the item.
Prison Bottle,Hold items,Transforms Hoopa Confined to Hoopa Unbound.
Prof\'s Letter,Hold items,A letter that Professor Sycamore wrote to your mother. A faint but pleasant perfume seems to cling to the paper.
Protective Pads,Hold items,An item to be held by a Pok\xc3\xa9mon. These pads protect the holder from effects caused by making direct contact with the target.
Protector,General items,Evolves Rhydon when traded holding the item.
Protein,Medicine,Increases Attack EVs by 10.
Psychic Gem,Hold items,Increases the power of a Psychic-type move only once.
Psychic Memory,Hold items,Changes Silvally and its move Multi-Attack to Psychic type.
Psychic Seed,Hold items,An item to be held by a Pok\xc3\xa9mon. It boosts Sp. Def on Psychic Terrain. It can only be used once.
Psychium Z,Hold items,"Allows the use of Shattered Psyche, the Psychic type Z-Move."
Pungent Root,General items,
Pure Incense,Hold items,Descreases the likelihood of meeting wild Pok\xc3\xa9mon. Breeding Chimecho produces Chingling when held.
Purple Nectar,Hold items,A flower nectar obtained at Poni Meadow. It changes the form of certain species of Pok\xc3\xa9mon.
Qualot Berry,Berries,Increases Friendship but lowers Defense EVs.
Quick Ball,Pokeballs,A somewhat different Pok\xc3\xa9 Ball that provides a better catch rate if it is used at the start of a wild encounter.
Quick Candy,Medicine,Increases a Pok\xc3\xa9mon\'s Speed stat by 1.
Quick Candy L,Medicine,Increases a Pok\xc3\xa9mon\'s Speed stat.
Quick Candy XL,Medicine,Increases a Pok\xc3\xa9mon\'s Speed stat.
Quick Claw,Hold items,"An item to be held by a Pok\xc3\xa9mon. A light, sharp claw that lets the bearer move first occasionally."
Quick Powder,Hold items,Increases Speed when held by Ditto.
Quiet Mint,Battle items,Changes the Pok\xc3\xa9mon\'s stats to match the Quiet nature.
Rabuta Berry,Berries,A Berry which is very rare in the Unova region. A maniac will buy it for a high price.
Rage Candy Bar,Medicine,Heals all major status conditions.
Rare Bone,General items,A bone that is extremely valuable for Pok\xc3\xa9mon archeology. It can be sold for a high price to shops.
Rare Candy,Medicine,A candy that is packed with energy. It raises the level of a single Pok\xc3\xa9mon by one.
Rash Mint,Battle items,Changes the Pok\xc3\xa9mon\'s stats to match the Rash nature.
Rawst Berry,Berries,"If held by a Pok\xc3\xa9mon, it recovers from a burn."
Razor Claw,Hold items,Increases critical-hit ratio. Evolves Sneasel when held at night.
Razor Fang,Hold items,May cause opponent to flinch. Evolves Gligar when held at night.
Razz Berry,Berries,A Berry which is very rare in the Unova region. A maniac will buy it for a high price.
Reaper Cloth,General items,Evolves Dusclops when traded holding the item.
Red Apricorn,General items,A red Apricorn. It assails your nostrils.
Red Card,Hold items,"A card with a mysterious power. When the holder is struck by a foe, the attacker is removed from battle."
Red Flute,General items,A toy flute made from red glass. A maniac will buy it for a high price.
Red Nectar,Hold items,A flower nectar obtained at Ula\'ula Meadow. It changes the form of certain species of Pok\xc3\xa9mon.
Red Scarf,General items,Raises holder\'s Cool aspect in a Contest.
Red Shard,General items,A small red shard. It appears to be from some sort of implement made long ago.
Relaxed Mint,Battle items,Changes the Pok\xc3\xa9mon\'s stats to match the Relaxed nature.
Relic Band,General items,"A bracelet made in a civilization about 3,000 years ago. A maniac will buy it for a high price."
Relic Copper,General items,"A copper coin used in a civilization about 3,000 years ago. A maniac will buy it for a high price."
Relic Crown,General items,"A crown made in a civilization about 3,000 years ago. A maniac will buy it for a high price."
Relic Gold,General items,"A gold coin used in a civilization about 3,000 years ago. A maniac will buy it for a high price."
Relic Silver,General items,"A silver coin used in a civilization about 3,000 years ago. A maniac will buy it for a high price."
Relic Statue,General items,"A stone figure made in a civilization about 3,000 years ago. A maniac will buy it for a high price."
Relic Vase,General items,"A vase made in a civilization about 3,000 years ago. A maniac will buy it for a high price."
Repeat Ball,Pokeballs,A somewhat different Pok\xc3\xa9 Ball that works especially well on Pok\xc3\xa9mon species that were previously caught.
Repel,General items,An item that prevents weak wild Pok\xc3\xa9mon from appearing for 100 steps after its use.
Reset Urge,Battle items,"When used, it restores any stat changes of an ally Pok\xc3\xa9mon."
Resist Wing,Medicine,Increases Defense EVs by 1.
Reveal Glass,General items,A looking glass that reveals the truth. It\'s a mysterious glass that returns a Pok\xc3\xa9mon to its original shape.
Revival Herb,Medicine,"Revives a Pok\xc3\xa9mon to max HP, but lowers Friendship."
Revive,Medicine,A medicine that revives a fainted Pok\xc3\xa9mon. It restores half the Pok\xc3\xa9mon\'s maximum HP.
Ribbon Sweet,Hold items,Evolves Milcery into Ribbon Flavor Alcremie.
Rindo Berry,Berries,Weakens a supereffective Grass-type attack against the holding Pok\xc3\xa9mon.
Ring Target,Hold items,Moves that would otherwise have no effect will land on the Pok\xc3\xa9mon that holds it.
Rock Gem,Hold items,Increases the power of a Rock-type move only once.
Rock Incense,Hold items,Increases the power of Rock-type moves. Breeding Sudowoodo produces Bonsly when held.
Rock Memory,Hold items,Changes Silvally and its move Multi-Attack to Rock type.
Rockium Z,Hold items,"Allows the use of Continental Crush, the Rock type Z-Move."
Rocky Helmet,Hold items,"If the holder of this item takes damage, the attacker will also be damaged upon contact."
Roller Skates,General items,"Attaches roller skates to the bottom of your shoes, allowing you to glide quickly around and perform tricks."
Room Service,Hold items,Lowers the Pok\xc3\xa9mon\'s speed during Trick Room.
Root Fossil,General items,A fossil of an ancient Pok\xc3\xa9mon that lived in the sea. It appears to be part of a plant root.
Rose Incense,Hold items,Increases the power of Grass-type moves. Breeding Roselia or Roserade produces Budew when held.
Roseli Berry,Berries,"If held by a Pok\xc3\xa9mon, this Berry will lessen the damage taken from one supereffective Fairy-type attack."
Roto Bargain,Battle items,Reduces the prices of products at Pok\xc3\xa9 Marts by half.
Roto Boost,Battle items,Raises all stats of your battling Pok\xc3\xa9mon.
Roto Catch,Battle items,Increases the chance to catch Pok\xc3\xa9mon a lot.
Roto Encounter,Battle items,Increases the chance of encountering high-level wild Pok\xc3\xa9mon a lot for a certain period of time.
Roto Exp. Points,Battle items,Increases the Exp. Points your Pok\xc3\xa9mon receive after battle a little.
Roto Friendship,Battle items,Helps Pok\xc3\xa9mon in your party grow friendly faster.
Roto Hatch,Battle items,Helps Eggs hatch faster.
Roto HP Restore,Battle items,Fully restores the HP of your battling Pok\xc3\xa9mon.
Roto PP Restore,Battle items,Fully restores the PP of your battling Pok\xc3\xa9mon.
Roto Prize Money,Battle items,Triples the prize money you receive after battle.
Roto Stealth,Battle items,Prevents you from encountering wild Pok\xc3\xa9mon for a certain period of time.
Rowap Berry,Berries,"If held by a Pok\xc3\xa9mon and a special attack lands, the attacker also takes damage."
Sablenite,Hold items,Enables Sableye to Mega Evolve during battle.
Sachet,General items,Evolves Spritzee when traded holding the item.
Sacred Ash,Medicine,"It revives all fainted Pok\xc3\xa9mon. In doing so, it also fully restores their HP."
Safari Ball,Pokeballs,A special Pok\xc3\xa9 Ball that is used only in the Great Marsh. It is decorated in a camouflage pattern.
Safety Goggles,Hold items,Prevents damage from weather and powder.
Salac Berry,Berries,Raises Speed when HP is low.
Salamencite,Hold items,Enables Salamence to Mega Evolve during battle.
Sassy Mint,Battle items,Changes the Pok\xc3\xa9mon\'s stats to match the Sassy nature.
Sceptilite,Hold items,Enables Sceptile to Mega Evolve during battle.
Scizorite,Hold items,Enables Scizor to Mega Evolve during battle.
Scope Lens,Hold items,Increases critical-hit ratio.
Sea Incense,Hold items,Increases the power of Water-type moves. Breeding Marill or Azumarill produces Azurill when held.
Serious Mint,Battle items,Changes the Pok\xc3\xa9mon\'s stats to match a neutral nature.
Shalour Sable,Medicine,Heals all major status conditions.
Sharp Beak,Hold items,Increases the power of Flying-type moves.
Sharpedonite,Hold items,Enables Sharpedo to Mega Evolve during battle.
Shed Shell,Hold items,"A tough, discarded carapace to be held by a Pok\xc3\xa9mon. It enables the holder to switch with a waiting Pok\xc3\xa9mon in battle."
Shell Bell,Hold items,An item to be held by a Pok\xc3\xa9mon. The holder\'s HP is restored a little every time it inflicts damage.
Shiny Charm,General items,A shiny charm said to increase the chance of finding a Shiny Pok\xc3\xa9mon in the wild.
Shiny Stone,General items,Evolves certain species of Pok\xc3\xa9mon.
Shoal Salt,General items,Pure salt that can be discovered deep inside the Shoal Cave. A maniac will buy it for a high price.
Shoal Shell,General items,A pretty seashell that can be found deep inside the Shoal Cave. A maniac will buy it for a high price.
Shock Drive,Hold items,Changes Techno Blast to an Electric-type move when held by Genesect.
Shuca Berry,Berries,Weakens a supereffective Ground-type attack against the holding Pok\xc3\xa9mon.
Silk Scarf,Hold items,Increases the power of Normal-type moves.
Silver Leaf,General items,
Silver Nanab Berry,Berries,"Greatly calms a Pok\xc3\xa9mon in battle, in Let\'s Go Pikachu/Eevee."
Silver Pinap Berry,Berries,"Greatly increases chance of getting items when a Pok\xc3\xa9mon is caught, in Pok\xc3\xa9mon Let\'s Go."
Silver Powder,Hold items,Increases the power of Bug-type moves.
Silver Razz Berry,Berries,Makes a Pok\xc3\xa9mon easier to catch in Pok\xc3\xa9mon Let\'s Go.
Sitrus Berry,Berries,"If held by a Pok\xc3\xa9mon, it heals the user\'s HP a little."
Skull Fossil,General items,A fossil from a prehistoric Pok\xc3\xa9mon that lived on the land. It appears to be part of a head.
Sky Plate,Hold items,Increases power of Flying-type moves. Changes Arceus\' type to Flying.
Slowbronite,Hold items,Enables Slowbro to Mega Evolve during battle.
Small Bouquet,General items,
Smart Candy,Medicine,Increases a Pok\xc3\xa9mon\'s Special Attack stat by 1.
Smart Candy L,Medicine,Increases a Pok\xc3\xa9mon\'s Special Attack stat.
Smart Candy XL,Medicine,Increases a Pok\xc3\xa9mon\'s Special Attack stat.
Smoke Ball,Hold items,An item to be held by a Pok\xc3\xa9mon. It enables the holder to flee from any wild Pok\xc3\xa9mon without fail.
Smooth Rock,Hold items,A Pok\xc3\xa9mon held item that extends the duration of the move Sandstorm used by the holder.
Snorlium Z,Hold items,"Allows Snorlax to upgrade Giga Impact to a Z-Move, Pulverizing Pancake."
Snowball,Hold items,Raises Attack if hit by an Ice-type move.
Soda Pop,Medicine,Restores 50 HP.
Soft Sand,Hold items,Increases the power of Ground-type moves.
Solganium Z,Hold items,"Allows Solgaleo to upgrade Sunsteel Strike to a Z-Move, Searing Sunraze Smash."
Soothe Bell,Hold items,An item to be held by a Pok\xc3\xa9mon. It is a bell with a comforting chime that calms the holder and makes it friendly.
Soul Dew,Hold items,Increases the power of Psychic- and Dragon-type moves when held by Latios or Latias. Increases Sp.Atk/Sp.Def prior to Gen 7.
Spell Tag,Hold items,Increases the power of Ghost-type moves.
Spelon Berry,Berries,A Berry which is very rare in the Unova region. A maniac will buy it for a high price.
Splash Plate,Hold items,Increases power of Water-type moves. Changes Arceus\' type to Water.
Spooky Plate,Hold items,Increases power of Ghost-type moves. Changes Arceus\' type to Ghost.
Sport Ball,Pokeballs,A special Pok\xc3\xa9 Ball for the Bug-Catching Contest.
Sprinklotad,General items,"A watering can shaped like a Lotad. It helps promote the healthy growth of any Berries planted in good, soft soil."
Stable Mulch,General items,A fertilizer to be spread on soft soil in regions where Berries are grown. A maniac will buy it for a high price.
Star Piece,General items,A shard of a pretty gem that sparkles in a red color. It can be sold at a high price to shops.
Star Sweet,Hold items,Evolves Milcery into Star Flavor Alcremie.
Stardust,General items,"Lovely, red-colored sand with a loose, silky feel. It can be sold at a high price to shops."
Starf Berry,Berries,Sharply raises a random stat when HP is low.
Steel Gem,Hold items,Increases the power of a Steel-type move only once.
Steel Memory,Hold items,Changes Silvally and its move Multi-Attack to Steel type.
Steelium Z,Hold items,"Allows the use of Corkscrew Crash, the Steel type Z-Move."
Steelixite,Hold items,Enables Steelix to Mega Evolve during battle.
Stick,Hold items,Increases critical-hit ratio when held by Farfetch\'d.
Sticky Barb,Hold items,A held item that damages the holder on every turn. It may latch on to foes and allies that touch the holder.
Stone Plate,Hold items,Increases power of Rock-type moves. Changes Arceus\' type to Rock.
Strange Souvenir,General items,An ornament depicting a Pok\xc3\xa9mon that is venerated as a protector in some region far from Kalos.
Strawberry Sweet,Hold items,Evolves Milcery into Strawberry Flavor Alcremie.
Stretchy Spring,General items,
Sun Stone,General items,Evolves certain species of Pok\xc3\xa9mon.
